{
  "$schema": "http://json-schema.org/draft-07/schema#",
  "$id": "https://raw.githubusercontent.com/minhlucncc/mzspec/main/mzspec.config.schema.json",
  "title": "mzspec project configuration",
  "description": "Per-project config that drives the mzspec gate-resolver and ship pipeline. mzspec layers on top of OpenSpec and reuses the openspec/ folder for artifacts.",
  "type": "object",
  "required": ["toolchains", "always"],
  "additionalProperties": true,
  "definitions": {
    "gate": {
      "type": "object",
      "required": ["name", "cmd"],
      "additionalProperties": false,
      "properties": {
        "name": { "type": "string", "description": "Short gate id, shown in the plan/evidence." },
        "cmd": { "type": "string", "description": "Shell command. `{dir}` is substituted with the touched unit directory." }
      }
    }
  },
  "properties": {
    "$schema": { "type": "string" },
    "mzspecVersion": { "type": "string", "description": "The mzspec release this project was installed/pinned from." },
    "openspec": {
      "type": "object",
      "description": "Where OpenSpec artifacts live; mzspec writes evidence/handoffs into this tree.",
      "properties": {
        "changesDir": { "type": "string" },
        "specsDir": { "type": "string" },
        "archivePattern": { "type": "string" },
        "evidenceDir": { "type": "string" }
      }
    },
    "git": {
      "type": "object",
      "properties": {
        "base": { "type": "string" },
        "branchPrefix": { "type": "string" },
        "specBranchPrefix": { "type": "string" },
        "changelog": { "type": "string" }
      }
    },
    "handoffDir": { "type": "string" },
    "toolchains": {
      "type": "object",
      "description": "One entry per toolchain. Declaration ORDER matters: on an equal-length path-prefix tie, the first-declared toolchain wins (declare `go` before `py` to keep a Go module authoritative over a same-named Python member).",
      "additionalProperties": {
        "type": "object",
        "required": ["dirs", "gates"],
        "additionalProperties": false,
        "properties": {
          "dirs": { "type": "array", "items": { "type": "string" }, "description": "Repo-relative package/module directories owned by this toolchain. Longest-prefix match wins." },
          "gates": { "type": "array", "items": { "$ref": "#/definitions/gate" } }
        }
      }
    },
    "bench": {
      "type": "object",
      "description": "Optional 'free ladder' that runs as its own unit and is auto-added when a trigger toolchain is touched.",
      "additionalProperties": false,
      "properties": {
        "prefix": { "type": "string", "description": "Path prefix that marks a bench change (e.g. 'benchmarks/')." },
        "dir": { "type": "string" },
        "alsoWhenToolchains": { "type": "array", "items": { "type": "string" }, "description": "Toolchains whose presence also triggers the bench ladder (e.g. ['py'])." },
        "gates": { "type": "array", "items": { "$ref": "#/definitions/gate" } }
      }
    },
    "metaPrefixes": {
      "type": "array",
      "items": { "type": "string" },
      "description": "Doc/spec/config-only path prefixes — no build/test gate beyond the always-gates."
    },
    "always": {
      "type": "array",
      "items": { "$ref": "#/definitions/gate" },
      "description": "Gates that run for every change (e.g. `openspec validate`)."
    },
    "migration": {
      "type": "object",
      "description": "Optional DB-migration always-gate, triggered when a touched path matches `pattern`.",
      "additionalProperties": false,
      "properties": {
        "pattern": { "type": "string", "description": "JS RegExp source matched against each touched path." },
        "gate": { "anyOf": [{ "$ref": "#/definitions/gate" }, { "type": "null" }] }
      }
    },
    "gatesDir": { "type": "string", "description": "Where this project's own gate scripts live (see the gate plugin contract)." },
    "templatesDir": { "type": "string", "description": "Where this project's optional, skill-like task-planning templates live (default openspec/templates). Each is a <name>/TEMPLATE.md planning guide consulted during planning; see the templates contract." },
    "customGates": {
      "type": "array",
      "description": "Project gate plugins. Each runs when its `when` matches the diff.",
      "items": {
        "type": "object",
        "required": ["name", "cmd"],
        "additionalProperties": false,
        "properties": {
          "name": { "type": "string" },
          "cmd": { "type": "string" },
          "when": {
            "type": "object",
            "additionalProperties": false,
            "properties": {
              "touches": { "type": "string", "description": "Path prefix that must be present in the diff." },
              "touchesMigrations": { "type": "boolean" },
              "touchesBench": { "type": "boolean" },
              "toolchains": { "type": "array", "items": { "type": "string" } }
            }
          }
        }
      }
    },
    "invariants": {
      "type": "array",
      "items": { "type": "string" },
      "description": "Project hard-invariants surfaced to the code-review / security skills."
    },
    "taskSources": {
      "type": "array",
      "description": "Backlog sources for /opsx:task-pull|push|log. The first `enabled` one is the default (override with --source).",
      "items": {
        "type": "object",
        "required": ["name", "type"],
        "additionalProperties": false,
        "properties": {
          "name": { "type": "string", "description": "Local identifier used by --source." },
          "type": { "type": "string", "enum": ["local-folder", "gh-issues", "mello-cli"] },
          "enabled": { "type": "boolean", "default": true },
          "config": {
            "type": "object",
            "description": "Adapter-specific settings: local-folder {path}; gh-issues {repo,label?,limit?}; mello-cli {board,column?,limit?}.",
            "additionalProperties": true
          }
        }
      }
    },
    "taskStatusMap": {
      "type": "object",
      "description": "Optional per-adapter status mapping. gh-issues: normalized->tokens ('+label','-label','state:closed','state:open'). mello-cli: { columns: { <status>: <columnName> } }. Adapters use sane defaults when omitted.",
      "additionalProperties": true
    }
  }
}
